"","study_ID","study_alias","study_accession","study_title","study_type","study_abstract","broker_name","center_name","center_project_name","study_description","related_studies","primary_study","sra_link","study_url_link","xref_link","study_entrez_link","ddbj_link","ena_link","study_attribute","submission_accession","sradb_updated","run_ID","bamFile","run_alias","run_accession","broker_name..26","instrument_name","run_date","run_file","run_center","total_data_blocks","experiment_accession","experiment_name","sra_link..34","run_url_link","xref_link..36","run_entrez_link","ddbj_link..38","ena_link..39","run_attribute","submission_accession..41","sradb_updated..42"
"1",91239,"PRJNA305507","SRP067325","Athlete Microbiome Project (AMP)","Other","Metagenomic sequencing to identify and measure the abundances of microorganisms present in stool samples from athletes",NA,"BioProject","human gut metagenome",NA,NA,NA,NA,NA,NA,NA,NA,NA,NA,"SRA319014","2016-12-15 19:35:21",2818847,NA,"J07687-1_files","SRR2992957",NA,NA,NA,NA,NA,NA,"SRX1479847",NA,NA,NA,NA,NA,NA,NA,NA,"SRA319014","2016-12-15 19:08:04"
"2",72675,"PRJNA301903","SRP069019","Metagenomic sequencing of preterm infant gut microbiota raw sequence reads","Other","Dysbiotic colonization of the preterm infant gut microbiota may have lifelong effects on host health. The normal progression of colonization of preterm infants is a patterned, yet chaotic, process, and thought to be chiefly driven by host factors. While preterm infants almost universally receive early and often repeated and/or prolonged intravenous antibiotic therapy, it remains unclear if and how specific antibiotics alter the developmental progression of the gut microbiota in this population. By analyzing 401 fecal samples from 84 longitudinally-sampled preterm infants, we demonstrate that meropenem, cefotaxime, and ticarcillin-clavulanate significantly reduce species richness during their administration, and significantly enrich or deplete specific bacterial species and antibiotic resistance (AR) genes. In contrast, vancomycin and gentamicin, the antibiotics most commonly administered to preterm infants, have non-uniform effects on species richness. We show this response is predictable with 85% accuracy based on the relative abundance of only two bacterial species and two AR genes before treatment. To more fully investigate the role of the gut-associated resistome in response to specific antibiotics, we performed functional metagenomic selections for resistance to 16 clinically relevant antibiotics from a set of 21 preterm infants’ gut microbiota. Of the 794 AR genes identified, 79% had not previously been classified as providing any resistance phenotype. Combined with deep shotgun sequencing of all 401 fecal samples, we find that multidrug resistant Escherichia, Klebsiella, and Enterobacter species, which are commonly associated with nosocomial infections, dominate the preterm infant gut microbiota. We show that AR genes that are enriched following specific antibiotic treatments are generally unique to the specific treatment and highly correlated (p<0.001) with the abundance of a single species. The most notable exception includes ticarcillin-clavulanate and ampicillin, both of which enrich a large number of overlapping AR genes, and are highly correlated with Klebsiella pneumoniae species in the preterm infant gut microbiota. In addition to AR genes relevant to specific antibiotics likely providing a protective function, we show that all antibiotic treatments also result in widespread collateral microbiome impact through enrichment of AR genes with no known direct activity against the specific antibiotic treatment.",NA,"BioProject","None",NA,NA,NA,NA,NA,NA,NA,NA,NA,NA,"SRA342712","2016-11-20 17:20:21",2413426,NA,"Unpaired_4-E1_quality_nohuman.fastq","SRR3131990",NA,NA,NA,NA,NA,NA,"SRX1551634",NA,NA,NA,NA,NA,NA,NA,NA,"SRA342712","2016-11-20 03:31:12"
"3",54687,"PRJNA260285","SRP046227","Municipal Pensacola Beach Sand Metagenome","Metagenomics","This study investigated the successional patterns of functional and taxonomic diversity for over one year after the Deepwater Horizon oil was deposited on Pensacola Beach sands (FL, USA), using metagenomic and 16S rRNA gene amplicon techniques.",NA,"BioProject","beach sand metagenome",NA,NA,NA,NA,"Additional associated data: http://enve-omics.ce.gatech.edu/data/oilspill",NA,NA,NA,NA,NA,"SRA181599","2016-11-20 17:10:25",1804566,NA,"OS_A","SRR1569742",NA,NA,NA,NA,NA,NA,"SRX696142","OS_A",NA,NA,NA,NA,NA,NA,"enve-omics ID: ENVE_0074: ","SRA181599","2016-11-19 23:56:33"
"4",5432,"MetaHIT-MGS","ERP002061","A method for identifying metagenomic species and variable genetic elements by exhaustive co-abundance binning","Metagenomics","The microbial diversity of environments like the human gut extends far beyond what is covered by reference genomes. Here we present a method for exhaustive and unsupervised co-abundance gene binning across a series of highly complex metagenomic samples. As the method does not rely on previously sequenced reference genomes it allows for discovery of new species, viruses and clonal heterogeneity. We demonstrate the method on human gut microbiome data and identify 7,381 co-abundance gene groups (CAGs) ranging in size from 3 to 6,319 genes. The CAGs represent a wide variety of biological entities including microbial genomes, phages and clonal differences. We name the 741 largest of these metagenomic species (MGS), because they correspond to microbial species. In addition, we establish microbial host affiliations by dependency-associations for many small CAGs. Longitudinal sampling in the same individuals indicates that some of these dependency-associations are important for the persistence of their microbial host","BGI","BGI",NA,"The microbial diversity of environments like the human gut extends far beyond what is covered by reference genomes. Here we present a method for exhaustive and unsupervised co-abundance gene binning across a series of highly complex metagenomic samples. As the method does not rely on previously sequenced reference genomes it allows for discovery of new species, viruses and clonal heterogeneity. We demonstrate the method on human gut microbiome data and identify 7,381 co-abundance gene groups (CAGs) ranging in size from 3 to 6,319 genes. The CAGs represent a wide variety of biological entities including microbial genomes, phages and clonal differences. We name the 741 largest of these metagenomic species (MGS), because they correspond to microbial species. In addition, we establish microbial host affiliations by dependency-associations for many small CAGs. Longitudinal sampling in the same individuals indicates that some of these dependency-associations are important for the persistence of their microbial host",NA,NA,NA,NA,NA,NA,NA,NA,NA,"ERA179067","2016-11-20 16:44:49",146838,NA,"ena-RUN-BGI-17-12-2012-03:35:15:615-77","ERR209131","BGI",NA,NA,NA,NA,NA,"ERX183796","ena-EXPERIMENT-BGI-17-12-2012-03:35:15:615-77",NA,NA,NA,NA,NA,NA,"instrument_model: Illumina Genome Analyzer IIx","ERA179067","2017-12-07 19:33:25"
"5",96524,"PRJNA369713","SRP099122","Ambulance Metagenome","Other","Raw sequence data from ambulances across the United States",NA,"BioProject",NA,NA,NA,NA,NA,NA,NA,NA,NA,NA,NA,"SRA536700","2017-02-16 20:38:19",3002126,NA,"AW0822_pair02.fastq.out.clean.gz","SRR5240389",NA,NA,NA,NA,NA,NA,"SRX2547261",NA,NA,NA,NA,NA,NA,NA,NA,"SRA536700","2017-02-16 19:32:07"
"6",97282,"PRJNA370011","SRP099442","Listeria monocytogenes Genome sequencing","Other","Quasi-metagenomics for rapid trace-back of pathogens from complex matrices: a case study with Listeria monocytogenes from ice-cream linked to an outbreak",NA,"BioProject","Listeria monocytogenes",NA,NA,NA,NA,NA,NA,NA,NA,NA,NA,"SRA537487","2017-02-23 20:22:56",3032047,NA,"40R1_L001_R1.fastq.gz","SRR5249720",NA,NA,NA,NA,NA,NA,"SRX2555554",NA,NA,NA,NA,NA,NA,NA,NA,"SRA537487","2017-02-23 19:52:06"
"7",49312,"PRJNA240307","SRP040146","C.diff FMT","Metagenomics","C.diff FMT",NA,"BioProject","human gut metagenome",NA,NA,NA,NA,NA,NA,NA,NA,NA,NA,"SRA146236","2016-11-20 17:07:29",1648015,NA,"C2GH3ACXX131009.3.tagged_579.screened.bam","SRR1462101",NA,NA,"2013-10-09 00:00:00",NA,"BI",NA,"SRX626739",NA,NA,NA,NA,NA,NA,NA,"analysis_type: AssemblyWithoutReference || data_type: WGS || flowcell_barcode: C2GH3ACXX || gssr_id: 405255.0 || instrument_name: SL-HEA || lane: 3 || library_type: WholeGenomeShotgun || lsid: broadinstitute.org:bsp.prod.sample:4VX3B || molecular_indexing_scheme: tagged_579 [GACAGTAA] || product_order: PDO-2112 || product_part_number: P-WG-0004 || project: G48214 || read_group_id: C2GH3.3 || read_group_platform_unit: C2GH3ACXX131009.3.GACAGTAA || research_project: RP-381 || root_sample_id: SM-4DLSE || run_barcode: C2GH3ACXX131009 || run_name: 131009_SL-HEA_0086_AFCC2GH3ACXX || sample_id: SM-4VX3B || screened: yes || work_request: 38305","SRA146236","2016-11-19 23:08:37"
"8",5432,"MetaHIT-MGS","ERP002061","A method for identifying metagenomic species and variable genetic elements by exhaustive co-abundance binning","Metagenomics","The microbial diversity of environments like the human gut extends far beyond what is covered by reference genomes. Here we present a method for exhaustive and unsupervised co-abundance gene binning across a series of highly complex metagenomic samples. As the method does not rely on previously sequenced reference genomes it allows for discovery of new species, viruses and clonal heterogeneity. We demonstrate the method on human gut microbiome data and identify 7,381 co-abundance gene groups (CAGs) ranging in size from 3 to 6,319 genes. The CAGs represent a wide variety of biological entities including microbial genomes, phages and clonal differences. We name the 741 largest of these metagenomic species (MGS), because they correspond to microbial species. In addition, we establish microbial host affiliations by dependency-associations for many small CAGs. Longitudinal sampling in the same individuals indicates that some of these dependency-associations are important for the persistence of their microbial host","BGI","BGI",NA,"The microbial diversity of environments like the human gut extends far beyond what is covered by reference genomes. Here we present a method for exhaustive and unsupervised co-abundance gene binning across a series of highly complex metagenomic samples. As the method does not rely on previously sequenced reference genomes it allows for discovery of new species, viruses and clonal heterogeneity. We demonstrate the method on human gut microbiome data and identify 7,381 co-abundance gene groups (CAGs) ranging in size from 3 to 6,319 genes. The CAGs represent a wide variety of biological entities including microbial genomes, phages and clonal differences. We name the 741 largest of these metagenomic species (MGS), because they correspond to microbial species. In addition, we establish microbial host affiliations by dependency-associations for many small CAGs. Longitudinal sampling in the same individuals indicates that some of these dependency-associations are important for the persistence of their microbial host",NA,NA,NA,NA,NA,NA,NA,NA,NA,"ERA179067","2016-11-20 16:44:49",147081,NA,"ena-RUN-BGI-17-12-2012-03:35:15:677-320","ERR209374","BGI",NA,NA,NA,NA,NA,"ERX184039","ena-EXPERIMENT-BGI-17-12-2012-03:35:15:677-320",NA,NA,NA,NA,NA,NA,NA,"ERA179067","2016-11-19 17:46:34"
"9",97282,"PRJNA370011","SRP099442","Listeria monocytogenes Genome sequencing","Other","Quasi-metagenomics for rapid trace-back of pathogens from complex matrices: a case study with Listeria monocytogenes from ice-cream linked to an outbreak",NA,"BioProject","Listeria monocytogenes",NA,NA,NA,NA,NA,NA,NA,NA,NA,NA,"SRA537487","2017-02-23 20:22:56",3032040,NA,"44R4_L001_R1.fastq.gz","SRR5249713",NA,NA,NA,NA,NA,NA,"SRX2555547",NA,NA,NA,NA,NA,NA,NA,NA,"SRA537487","2017-02-23 19:52:06"
"10",49312,"PRJNA240307","SRP040146","C.diff FMT","Metagenomics","C.diff FMT",NA,"BioProject","human gut metagenome",NA,NA,NA,NA,NA,NA,NA,NA,NA,NA,"SRA146236","2016-11-20 17:07:29",1648007,NA,"C2G6PACXX131009.3.tagged_309.screened.bam","SRR1462092",NA,NA,"2013-10-09 00:00:00",NA,"BI",NA,"SRX626773",NA,NA,NA,NA,NA,NA,NA,"analysis_type: AssemblyWithoutReference || data_type: WGS || flowcell_barcode: C2G6PACXX || gssr_id: 405248.0 || instrument_name: SL-HEB || lane: 3 || library_type: WholeGenomeShotgun || lsid: broadinstitute.org:bsp.prod.sample:4VX34 || molecular_indexing_scheme: tagged_309 [CAACTCTC] || product_order: PDO-2112 || product_part_number: P-WG-0004 || project: G48245 || read_group_id: C2G6P.3 || read_group_platform_unit: C2G6PACXX131009.3.CAACTCTC || research_project: RP-381 || root_sample_id: SM-4DLTA || run_barcode: C2G6PACXX131009 || run_name: 131009_SL-HEB_0090_BFCC2G6PACXX || sample_id: SM-4VX34 || screened: yes || work_request: 38305","SRA146236","2016-11-19 23:08:36"
"11",124146,NA,"SRP099633",NA,NA,NA,NA,NA,NA,NA,NA,NA,NA,NA,NA,NA,NA,NA,NA,"SRA537985","2017-12-21 17:54:41",4040071,NA,NA,"SRR5253647",NA,NA,NA,NA,NA,NA,NA,NA,NA,NA,NA,NA,NA,NA,NA,"SRA537985","2017-12-21 17:56:08"
"12",51179,"PRJNA278393","SRP056480","Metagenome sequencing of the Hadza hunter-gatherer gut microbiota.","Metagenomics","By human microbiome sequencing we can better understand how host evolutionary and ontogenetic history is reflected in the microbial function. However, there has been no information on the gut metagenome configuration in hunter-gatherer populations, posing a gap in our knowledge of gut microbiota (GM)-host mutualism arising from a lifestyle that describes over 90% of human evolutionary history. Here, we present the first metagenomic analysis of GM from Hadza hunter-gatherers of Tanzania, showing a unique enrichment in metabolic pathways that align with the dietary and environmental factors characteristic of their foraging lifestyle. We found that the Hadza GM is adapted for broad spectrum carbohydrate metabolism, reflecting the complex polysaccharides in their diet. Furthermore, the Hadza GM is equipped for branched-chain amino acid degradation and aromatic amino acid biosynthesis. Resistome functionality demonstrates the existence of antibiotic resistance genes in a population with little to no antibiotic exposure, indicating the ubiquitous presence of environmentally derived resistances. Our results demonstrate how the functional specificity of the GM correlates with environment and lifestyle, and how complexity from the exogenous environment is matched by endogenous homeostasis. The Hadza gut metagenome structure allows to appreciate the co-adaptive functional role of the GM in complementing the human physiology, providing a better understanding of the versatility of human life and subsistence.",NA,"BioProject","human gut metagenome",NA,NA,NA,NA,NA,"pubmed: 25981789",NA,NA,NA,NA,"SRA165362","2016-11-20 17:08:28",1705940,NA,"IT4","SRR1930777",NA,NA,NA,NA,NA,NA,"SRX967680",NA,NA,NA,NA,NA,NA,NA,NA,"SRA165362","2016-11-19 23:28:25"
"13",49312,"PRJNA240307","SRP040146","C.diff FMT","Metagenomics","C.diff FMT",NA,"BioProject","human gut metagenome",NA,NA,NA,NA,NA,NA,NA,NA,NA,NA,"SRA146236","2016-11-20 17:07:29",1648036,NA,"C2G6PACXX131009.4.tagged_223.screened.bam","SRR1462447",NA,NA,"2013-10-09 00:00:00",NA,"BI",NA,"SRX616467",NA,NA,NA,NA,NA,NA,NA,"analysis_type: AssemblyWithoutReference || data_type: WGS || flowcell_barcode: C2G6PACXX || gssr_id: 405245.0 || instrument_name: SL-HEB || lane: 4 || library_type: WholeGenomeShotgun || lsid: broadinstitute.org:bsp.prod.sample:4VX31 || molecular_indexing_scheme: tagged_223 [AGGTTATC] || product_order: PDO-2112 || product_part_number: P-WG-0004 || project: G48221 || read_group_id: C2G6P.4 || read_group_platform_unit: C2G6PACXX131009.4.AGGTTATC || research_project: RP-381 || root_sample_id: SM-4DLSL || run_barcode: C2G6PACXX131009 || run_name: 131009_SL-HEB_0090_BFCC2G6PACXX || sample_id: SM-4VX31 || screened: yes || work_request: 38305","SRA146236","2016-11-19 23:08:37"
"14",52624,"PRJNA253699","SRP044024","Methane enrichments of freshwater lake sediment","Metagenomics","Observations on the dynamics of bacterial communities in response to methane stimulus in laboratory microcosm incubations prepared with Lake Washington sediment samples. Whole metagenome sequencing of short-term community dynamics, in two oxygen tension regimens (‘high’ and ‘low’), observing rapid loss of species diversity.",NA,"BioProject","freshwater sediment metagenome",NA,NA,NA,NA,NA,NA,NA,NA,NA,NA,"SRA172917","2016-11-20 17:09:15",1736042,NA,"Mila-2_S2","SRR1505167",NA,NA,NA,NA,NA,NA,"SRX644731","Mila-2_S2",NA,NA,NA,NA,NA,NA,NA,"SRA172917","2016-11-19 23:40:00"
"15",113131,"PRJNA379709","SRP102190","Species and functional composition of gut bacteria from TGF-Beta deficient H. hepaticus positive mice","Other","Raw DNA and RNA sequences from bacterial content of mouse cecum were generated to identify species and functions associated with colorectal cancer.",NA,"BioProject","Bacteria",NA,NA,NA,NA,NA,NA,NA,NA,NA,NA,"SRA547799","2017-08-24 20:06:27",3621159,NA,"Lib GCCAAT_L007_002 Mouse 129 Strain SMAD3-/- Cecal DNA content_files","SRR5382269",NA,NA,NA,NA,NA,NA,"SRX2677422",NA,NA,NA,NA,NA,NA,NA,NA,"SRA547799","2017-08-24 19:24:04"
"16",130652,NA,"SRP131894",NA,NA,NA,NA,NA,NA,NA,NA,NA,NA,NA,NA,NA,NA,NA,NA,"SRA654526","2018-02-12 13:58:00",4308301,NA,NA,"SRR6659417",NA,NA,NA,NA,NA,NA,NA,NA,NA,NA,NA,NA,NA,NA,NA,"SRA654526","2018-02-12 13:59:32"
"17",130652,NA,"SRP131894",NA,NA,NA,NA,NA,NA,NA,NA,NA,NA,NA,NA,NA,NA,NA,NA,"SRA654526","2018-02-12 13:58:00",4308469,NA,NA,"SRR6659585",NA,NA,NA,NA,NA,NA,NA,NA,NA,NA,NA,NA,NA,NA,NA,"SRA654526","2018-02-12 13:59:32"
"18",97282,"PRJNA370011","SRP099442","Listeria monocytogenes Genome sequencing","Other","Quasi-metagenomics for rapid trace-back of pathogens from complex matrices: a case study with Listeria monocytogenes from ice-cream linked to an outbreak",NA,"BioProject","Listeria monocytogenes",NA,NA,NA,NA,NA,NA,NA,NA,NA,NA,"SRA537487","2017-02-23 20:22:56",3032042,NA,"44R2_L001_R2.fastq.gz","SRR5249715",NA,NA,NA,NA,NA,NA,"SRX2555549",NA,NA,NA,NA,NA,NA,NA,NA,"SRA537487","2017-02-23 19:52:06"
"19",151519,NA,"SRP141132",NA,NA,NA,NA,NA,NA,NA,NA,NA,NA,NA,NA,NA,NA,NA,NA,"SRA692805","2018-07-19 17:51:58",5174099,NA,NA,"SRR7039254",NA,NA,NA,NA,NA,NA,NA,NA,NA,NA,NA,NA,NA,NA,NA,"SRA692805","2018-07-19 17:53:48"
"20",124461,NA,"SRP126034",NA,NA,NA,NA,NA,NA,NA,NA,NA,NA,NA,NA,NA,NA,NA,NA,"SRA635598","2017-12-21 17:54:41",4066371,NA,NA,"SRR6339791",NA,NA,NA,NA,NA,NA,NA,NA,NA,NA,NA,NA,NA,NA,NA,"SRA635598","2017-12-21 17:56:08"
"21",91312,"PRJNA340876","SRP083779","food contamination metagenome Metagenome","Other","fresh bagged spinach spiked with STEC",NA,"BioProject","food contamination metagenome",NA,NA,NA,NA,NA,"pubmed: 27930729",NA,NA,NA,NA,"SRA458525","2017-06-22 20:02:38",2823982,NA,"EC1917m1_S8_L001_R2_001.fastq.gz","SRR4101303",NA,NA,NA,NA,NA,NA,"SRX2068897",NA,NA,NA,NA,NA,NA,NA,NA,"SRA458525","2016-12-15 19:14:40"
"22",62854,"PRJNA269954","SRP056002","Paired mucosal j-pouch and afferent limb samples from postoperative ulcerative colitis and familial ademonatous polyposis patients from Mount Sinai Hospital, Toronto. Samples were collected during pouch endoscopy and 16S sequenced.","Metagenomics","Paired mucosal j-pouch and afferent limb samples from postoperative ulcerative colitis and familial ademonatous polyposis patients from Mount Sinai Hospital, Toronto. Samples were collected during pouch endoscopy and 16S sequenced.",NA,"BioProject","human gut metagenome",NA,NA,NA,NA,NA,NA,NA,NA,NA,NA,"SRA246099","2016-11-20 17:14:54",2016493,NA,"D2F1CACXX130830.6.tagged_163.screened.bam","SRR1980431",NA,NA,"2013-08-30 00:00:00",NA,"BI",NA,"SRX999457",NA,NA,NA,NA,NA,NA,NA,"analysis_type: AssemblyWithoutReference || data_type: WGS || flowcell_barcode: D2F1CACXX || gssr_id: 377536.0 || instrument_name: SL-HEC || lane: 6 || library_type: WholeGenomeShotgun || lsid: broadinstitute.org:bsp.prod.sample:4QG5N || molecular_indexing_scheme: tagged_163 [ACTGTATC] || product_order: PDO-1770 || product_part_number: P-WG-0004 || project: G45117 || read_group_id: D2F1C.6 || read_group_platform_unit: D2F1CACXX130830.6.ACTGTATC || research_project: RP-315 || root_sample_id: SM-3T2H3 || run_barcode: D2F1CACXX130830 || run_name: 130830_SL-HEC_0056_AFCD2F1CACXX || sample_id: SM-4QG5N || screened: yes || work_request: 37544","SRA246099","2016-11-20 01:31:17"
"23",62855,"PRJNA231909","SRP056054","A prospective, longitudinal analysis of the developing gut microbiome in infants en route to type 1 diabetes","Metagenomics","This is a prospective, longitudinal collection of stool samples from infants at risk for disease. Infants from Finland and Estonia were recruited at birth based on HLA risk genotyping. Parents collected their infants’ stool at approximately monthly intervals and promptly stored the sample in the freezer prior to shipment for sample processing and sequencing. The cohort comprised of 33 infants, 11 of which seroconverted to serum autoantibody positivity and of those, four developed T1D within the three year time-frame of this study.",NA,"BioProject","human gut metagenome",NA,NA,NA,NA,NA,NA,NA,NA,NA,NA,"SRA246099","2016-11-20 17:14:54",2016493,NA,"D2F1CACXX130830.6.tagged_163.screened.bam","SRR1980431",NA,NA,"2013-08-30 00:00:00",NA,"BI",NA,"SRX999457",NA,NA,NA,NA,NA,NA,NA,"analysis_type: AssemblyWithoutReference || data_type: WGS || flowcell_barcode: D2F1CACXX || gssr_id: 377536.0 || instrument_name: SL-HEC || lane: 6 || library_type: WholeGenomeShotgun || lsid: broadinstitute.org:bsp.prod.sample:4QG5N || molecular_indexing_scheme: tagged_163 [ACTGTATC] || product_order: PDO-1770 || product_part_number: P-WG-0004 || project: G45117 || read_group_id: D2F1C.6 || read_group_platform_unit: D2F1CACXX130830.6.ACTGTATC || research_project: RP-315 || root_sample_id: SM-3T2H3 || run_barcode: D2F1CACXX130830 || run_name: 130830_SL-HEC_0056_AFCD2F1CACXX || sample_id: SM-4QG5N || screened: yes || work_request: 37544","SRA246099","2016-11-20 01:31:17"
"24",8140,"ena-STUDY-CSISP-05-03-2014-16:02:34:121-87","ERP005196","Human gut microbiota associated to Clostridium difficile infection","Metagenomics","We performed a follow-up study of the gut microbiota in patients treated with antibiotic therapy, whom developed Clostridium difficile infection as a consequence. We used the 16s rRNA and metagenomic approaches to gain insights in the effect of the pathogen infection in the structure and functions of the human gut microbiota.",NA,"CSISP","Gut microbiota & Clostridium difficile","We performed a follow-up study of the gut microbiota in patients treated with antibiotic therapy, whom developed Clostridium difficile infection as a consequence. We used the 16s rRNA and metagenomic approaches to gain insights in the effect of the pathogen infection in the structure and functions of the human gut microbiota.",NA,NA,NA,NA,NA,NA,NA,NA,NA,"ERA293179","2016-11-20 16:46:05",282833,NA,"ena-RUN-CSISP-05-03-2014-16:02:28:965-11","ERR453546",NA,NA,NA,NA,NA,NA,"ERX419918","ena-EXPERIMENT-CSISP-05-03-2014-16:02:28:965-11",NA,NA,NA,NA,NA,NA,NA,"ERA293179","2016-11-19 18:05:23"
"25",90411,"PRJNA294203","SRP066735","Cheney Reservoir (KS) microbiome metagenomic assembly","Metagenomics","Application of molecular tools to identify taste and odor producing bacteria and toxigenic cyanobacteria in US drinking water reservoirs. Additionally, the effect that cyanobacterial blooms have on the microbial community was assessed.",NA,"BioProject","lake water metagenome",NA,NA,NA,NA,NA,NA,NA,NA,NA,NA,"SRA313927","2016-12-08 19:39:28",2791317,NA,"CRKS31","SRR2962468",NA,NA,NA,NA,NA,NA,"SRX1453446",NA,NA,NA,NA,NA,NA,NA,NA,"SRA313927","2016-12-08 19:14:49"
"26",161207,NA,"SRP162387",NA,NA,NA,NA,NA,NA,NA,NA,NA,NA,NA,NA,NA,NA,NA,NA,"SRA777555","2018-10-11 17:51:18",5653269,NA,NA,"SRR7892483",NA,NA,NA,NA,NA,NA,NA,NA,NA,NA,NA,NA,NA,NA,NA,"SRA777555","2018-10-11 17:53:59"
"27",49312,"PRJNA240307","SRP040146","C.diff FMT","Metagenomics","C.diff FMT",NA,"BioProject","human gut metagenome",NA,NA,NA,NA,NA,NA,NA,NA,NA,NA,"SRA146236","2016-11-20 17:07:29",1648355,NA,"C2G6PACXX131009.3.tagged_422.screened.bam","SRR1490872",NA,NA,"2013-10-09 00:00:00",NA,"BI",NA,"SRX616496",NA,NA,NA,NA,NA,NA,NA,"analysis_type: AssemblyWithoutReference || data_type: WGS || flowcell_barcode: C2G6PACXX || gssr_id: 405298.0 || instrument_name: SL-HEB || lane: 3 || library_type: WholeGenomeShotgun || lsid: broadinstitute.org:bsp.prod.sample:4VX4J || molecular_indexing_scheme: tagged_422 [CCTACCAT] || product_order: PDO-2112 || product_part_number: P-WG-0004 || project: G48210 || read_group_id: C2G6P.3 || read_group_platform_unit: C2G6PACXX131009.3.CCTACCAT || research_project: RP-381 || root_sample_id: SM-4DLSA || run_barcode: C2G6PACXX131009 || run_name: 131009_SL-HEB_0090_BFCC2G6PACXX || sample_id: SM-4VX4J || screened: yes || work_request: 38305","SRA146236","2016-11-19 23:08:39"
"28",57180,"PRJNA264280","SRP049045","Abundance of antibiotic resistance genes and structure of the microbial community in wastewater of medical facilities besides hospitals","Metagenomics","Sewage samples were collected from wastewater systems of different medical facilities. The aim of this study is to investigate the abundance of Antibiotic Resistance Genes and microbial diversity in sewage using Illumina high-throughput sequencing.",NA,"BioProject","wastewater metagenome",NA,NA,NA,NA,NA,NA,NA,NA,NA,NA,"SRA192497","2016-11-20 17:11:45",1843464,NA,"C1746","SRR1616981",NA,NA,NA,NA,NA,NA,"SRX735613","C1746",NA,NA,NA,NA,NA,NA,NA,"SRA192497","2016-11-20 00:09:25"
